,Dialogue,True_Symptom,Extracted_Symptom
0," ""My mouth corners crack and bleed, it's like my lips are splitting open, and it hurts so much, I can't even eat, I'm so tired and weak, I can't even get out of bed, I'm so depressed, I just want to die, I'm so sorry, I know I should see a doctor, but I just can't afford it, I'm so sorry, please help me, I'm begging you, please help me, I'm so sorry, I know I should see a doctor, but I just can't afford it, I'm so sorry, please help me, I'm begging you, please help me, I'm so sorry, I know I should see a doctor, but I just can't afford it, I'm so sorry, please help me, I'm begging you, please help me, I'm so sorry, I know I should see a doctor, but I just can't afford it, I'm so sorry, please help me, I'm begging you, please help me, I'm so sorry, I know I should see a doctor, but I just can't afford it, I'm so sorry, please help me, I'm begging you, please help me, I'm so sorry, I know I should see a doctor, but I just can't afford it, I'm so sorry, please help me, I'm begging you, please help me, I'm so sorry, I know I should see",Cracking at the corners of the mouth (cheilosis/cheilitis),cheilosis/cheilitis
1," ""I got these bloody cracks at the corners of me mouth, and they won't go away. It's been months now, and I'm getting bloody worried. I tried every bloody thing I could find on the internet, but nothing seems to work. I even tried bloody tea bags, but that just made it worse. I'm getting so frustrated, I just want to rip the bloody things off, but I'm scared I'll make it worse. I just want me mouth to be normal again.""",Cracking at the corners of the mouth (cheilosis/cheilitis),cheilosis/cheilitis
2," ""My mouth is a parched desert, cracked and dry, with a bitter taste that lingers on my tongue, as if I had swallowed a mouthful of sand.""",Cracking at the corners of the mouth (cheilosis/cheilitis),dry mouth
3," ""My mouth is cracking at the corners, and it feels like my lips are splitting open, and I am terrified that I will bleed to death.""",Cracking at the corners of the mouth (cheilosis/cheilitis),cheilosis/cheilitis
4," ""My mouth is a cracked and parched desert, where even the tiniest of raindrops would be a welcome respite from the scorching heat.""",Cracking at the corners of the mouth (cheilosis/cheilitis),dry mouth
5," ""I got these bloody cracks at the corners of me mouth, an' it's been goin' on fer weeks now. It's so bloody annoying, I can't even eat me meals properly no more. I tried everythin' I could think of, but nothin' seems ta work. I even tried rubbin' me mouth with sugar, but that didn't work neither. I'm so bloody frustrated, I don't know what ta do no more.""",Cracking at the corners of the mouth (cheilosis/cheilitis),cheilosis/cheilitis
6," ""I have noticed that the corners of my mouth have been cracking and bleeding for the past few days. It started after I began taking a new medication for my anxiety. I have tried to moisturize my lips with lip balm, but it does not seem to help. The cracks are very deep and painful, especially when I smile or talk. I am worried that it may become infected.""",Cracking at the corners of the mouth (cheilosis/cheilitis),cheilosis/cheilitis
7," ""I have been having difficulty swallowing for a while now, but it has gotten much worse over the past few days. It feels like there is a lump in my throat that I cannot swallow. I tried to eat a sandwich yesterday, but I couldn't swallow it. I had to spit it out. It is very frustrating and scary. I am worried that I might choke to death.""",Difficulty Swallowing,difficulty swallowing
8," ""I cant swollow nothin, its like somethin is stuck in my throat all the time, and when i try to eat or drink somethin it feels like its goin down the wrong pipe and i cant breathe properley, its like im tryin to swallow a fukin brick, and its gettin worse and worse, i cant even swallow my own spit, its like im dyin or somethin, i cant take this no more, i need help, i need it now, i cant wait no more, i cant swollow, i cant swollow, i cant swollow, i cant swollow, i cant swollow, i cant swollow, i cant swollow, i cant swollow, i cant swollow, i cant swollow, i cant swollow, i cant swollow, i cant swollow, i cant swollow, i cant swollow, i cant swollow, i cant swollow, i cant swollow, i cant swollow, i cant swollow, i cant swollow, i cant swollow, i cant swollow, i cant swollow, i cant swollow, i cant swollow, i cant swollow, i cant swollow, i cant swollow, i cant swollow, i cant swollow, i cant swollow, i cant swollow, i cant swollow, i cant swollow, i cant swollow, i cant swollow, i cant swollow",Difficulty Swallowing,difficulty swallowing
9," ""i cant swallow properly, its like food gets stuck in my throat and i cant breathe properly, its really scary""",Difficulty Swallowing,difficulty swallowing
10," ""My throat is on fire and every time I try to swallow it feels like I am swallowing a red hot coal.""",Difficulty Swallowing,hoarseness
11," ""I cant swallow properly, its like food gets stuck in my throat and i have to cough it up.""",Difficulty Swallowing,difficulty swallowing
12," ""I've been having trouble swallowing lately, especially with liquids.""",Difficulty Swallowing,dysphagia
13," ""I cant swollow nothin. Everythin I try to eat or drink gets stuck in my throat and I cant breathe. Its like somethin is stuck there and I cant get it out. I cant even swallow my own spit. Its like my esophagus is closed or somethin. I cant even talk right now cuz its so hard to swallow. I cant even breathe right now cuz its so hard to swallow. I cant even think straight cuz its so hard to swallow. I cant even sleep cuz its so hard to swallow. I cant even eat cuz its so hard to swallow. I cant even drink cuz its so hard to swallow. I cant even breathe cuz its so hard to swallow. I cant even think cuz its so hard to swallow. I cant even sleep cuz its so hard to swallow. I cant even eat cuz its so hard to swallow. I cant even drink cuz its so hard to swallow. I cant even breathe cuz its so hard to swallow. I cant even think cuz its so hard to swallow. I cant even sleep cuz its so hard to swallow. I cant even eat cuz its so hard to swallow. I cant even drink cuz its so hard to swallow. I cant even breathe cuz its so hard to swallow. I cant even think cuz its so hard to swallow. I cant even sleep cuz its so hard to swallow. I cant even eat cuz its so hard to swallow. I cant even drink cuz its so hard to swallow. I cant",Difficulty Swallowing,difficulty swallowing
14," ""I have had dry mouth for a while now, but it's gotten so bad that I can't even talk properly. My tongue feels like sandpaper and it's so dry that I can see the saliva trails on my lips. I've tried drinking more water and using artificial saliva, but it doesn't seem to help. I'm so frustrated and embarrassed because I can't even talk to my friends and family properly.""",Dry Mouth,dry mouth
15," ""I have an extremely dry mouth, it's as if I've been sucking on a desert for weeks, and my tongue feels like sandpaper.""",Dry Mouth,dry mouth
16," ""I've been having this dry mouth thing for a while now, but it's gotten worse recently.""",Dry Mouth,dry mouth
17," ""My mouth is as dry as the Sahara desert, and I fear I may never be able to quench this thirst.""",Dry Mouth,dry mouth
18," ""I can't stop thinking about how dry my mouth is all the time. It's like sandpaper in there.""",Dry Mouth,dry mouth
19," ""I have noticed that my mouth is drier than usual these days.""",Dry Mouth,dry mouth
20," ""I have been experiencing a severe dry mouth for the past few days.""",Dry Mouth,dry mouth
21," ""I have been hoarse for a while now, but it seems to be getting worse and worse.""",Hoarseness,hoarseness
22," ""I've been having this weird hoarseness for a while now, but I thought it was just from screaming at the TV during the game. But now I'm starting to think it's something more serious. I mean, I can barely talk without my voice cracking. And it's not just my voice that's affected, I feel like I've lost my sense of taste too. I mean, I tried eating a sandwich the other day and it just tasted like cardboard. And I've been coughing up this weird stuff that looks like phlegm, but it's not phlegm. It's like this weird greyish-white stuff. I don't know what's going on with my body, but I'm really scared.""",Hoarseness,hoarseness
23," ""My voice is but a whisper now, a faint echo of what it once was, and I fear it may soon fade away completely.""",Hoarseness,hoarseness
24," ""I got a hoarse voice, it's like I got a frog in my throat, I can't even talk properly, I sound like a croak, it's so annoying, I can't even sleep at night because of it, I'm so sick of it, I just want to get rid of it already.""",Hoarseness,hoarseness
25," ""I've been having this hoarseness for a while now, and it's really starting to freak me out. It's like my voice is going away, and I'm scared I'll never get it back.""",Hoarseness,hoarseness
26," ""My voice is all raspy and rough, like a worn out record player, and it's really annoying me, because I'm a singer, and I need to practice my scales, but I can't even hit the high notes without sounding like a dying swan.""",Hoarseness,hoarseness
27," ""My voice is all raspy and rough, like sandpaper scraping against my vocal cords.""",Hoarseness,hoarseness
28," ""I got these bloody sores in my mouth and throat, and they're so painful I can't even eat or drink properly. They're all over the place, inside my mouth and on the back of my throat. They're so sore I can't even talk properly, and when I try to eat or drink, it feels like I'm swallowing razor blades. I can't even sleep properly because of the pain, and I'm so stressed out about it I'm starting to lose my mind.""",Mouth/throat sores,mouth/throat sores
29," ""I have been experiencing these bloody mouth sores for weeks now and they are getting worse and worse.""",Mouth/throat sores,mouth/throat sores
30," ""I have these little sores in my mouth and throat that keep coming back.""",Mouth/throat sores,mouth/throat sores
31," ""My mouth is a bloody battlefield, a war zone of sores and pain, a place where even the most innocent of foods taste like ash and bitterness.""",Mouth/throat sores,mouth/throat sores
32," ""I have been having these mouth sores for a while now.""",Mouth/throat sores,mouth sores
33," ""I have been experiencing some mouth and throat sores for the past few days. They are very painful and I have been having difficulty eating and drinking. I also have a fever and chills.""",Mouth/throat sores,"mouth/throat sores, fever"
34," ""I've been having these little sores in my mouth and throat for a few days now. They're really painful and make it hard to eat and talk.""",Mouth/throat sores,mouth/throat sores
35," ""My mouth is a battlefield, with sores that are as red as rubies, and as sore as a thousand suns.""",Mouth/throat sores,mouth sores
36," ""i got these blisters in my mouth and throat and i dont know what to do with them they hurt so bad when i eat or drink""",Mouth/throat sores,mouth/throat sores
37," ""I got these bloody sores in the back of my throat and on the inside of my mouth. They're so painful that I can't even swallow properly. I've been trying to eat and drink, but it's like swallowing razor blades. I've been trying to talk, but it's like my tongue is on fire. I've been trying to sleep, but it's like my mouth is on fire. I've been trying to eat and drink, but it's like my mouth is on fire. I've been trying to talk, but it's like my mouth is on fire. I've been trying to sleep, but it's like my mouth is on fire. I've been trying to eat and drink, but it's like my mouth is on fire. I've been trying to talk, but it's like my mouth is on fire. I've been trying to sleep, but it's like my mouth is on fire. I've been trying to eat and drink, but it's like my mouth is on fire. I've been trying to talk, but it's like my mouth is on fire. I've been trying to sleep, but it's like my mouth is on fire. I've been trying to eat and drink, but it's like my mouth is on fire. I've been trying to talk, but it's like my mouth is on fire. I've been trying to sleep, but it's like my mouth is on fire. I've been trying",Mouth/throat sores,mouth/throat sores
38," ""I have mouth/throat sores, it hurts when I eat or drink.""",Mouth/throat sores,mouth/throat sores
39," ""My mouth is a battlefield, with sores popping up everywhere, like bloody volcanoes erupting, and I can't even eat a simple meal without my tongue feeling like sandpaper, and I'm so angry that I can't even sleep at night because of the pain and discomfort, and I'm so tired of taking medication that doesn't even work, and I'm so sick of being sick!""",Mouth/throat sores,mouth sores
40," ""I got these bloody sores in me gob and they won't bloody heal. I've had them for weeks now and I'm sick of eating shite food. I want a decent bloody meal for once.""",Mouth/throat sores,mouth/throat sores
41," ""I have been experiencing these mouth/throat sores for the past week now, and they are becoming increasingly painful. They are located on the inside of my cheeks, my tongue, and the roof of my mouth. I have been trying to eat as usual, but it is becoming very difficult because of the pain. Even drinking water is becoming a challenge. I have been trying to brush my teeth as usual, but the pain from the sores makes it very uncomfortable. I have been trying to talk as usual, but the pain from the sores makes it very uncomfortable. I have been trying to sleep as usual, but the pain from the sores makes it very uncomfortable. I have been trying to work as usual, but the pain from the sores makes it very uncomfortable.""",Mouth/throat sores,mouth/throat sores
42," ""I've been having these mouth/throat sores for a while now, and they're really annoying. They're these little red bumps that show up inside my mouth and on the back of my throat, and they hurt a little bit when I eat or talk.""",Mouth/throat sores,mouth/throat sores
43," ""I can't even eat a f**king sandwich without getting a mouthful of sores in my mouth.""",Mouth/throat sores,mouth/throat sores
44," ""I've been having these little sores in my mouth and throat for a few days now.""",Mouth/throat sores,mouth/throat sores
45," ""I have these blisters in my mouth and throat that are very painful and keep bleeding.""",Mouth/throat sores,mouth/throat sores
46," ""I am so fed up with these bloody mouth sores. They are so annoying and painful. I have had them for a week now and I just want them to go away. I have been trying to eat as usual but it is so hard with these sores in my mouth. I have been trying to brush my teeth as usual but it is so painful. I just want to get rid of these bloody sores already.""",Mouth/throat sores,mouth sores
47," ""I got these blisters in me mouth and throat, and they're really sore, man.""",Mouth/throat sores,mouth/throat sores
48," ""I cant even eat a sandwich without getting a sore in my mouth.""",Mouth/throat sores,mouth/throat sores
49," ""I got these blisters in my mouth and throat, and they're really painful. I can't even swallow properly, and I keep getting these blisters all over my mouth and tongue. I don't know what's causing them, but I think it might be something I ate. I've been eating a lot of spicy food lately, and I've also been drinking a lot of alcohol. I don't know if that's what's causing it, but I think it might be. I've tried to look it up online, but I can't find anything that matches my symptoms. I'm really worried about this, and I don't know what to do.""",Mouth/throat sores,blister
50," ""I got these blisters in my mouth and throat and it's been buggin me for a few days now. I can't even swallow properly and it hurts like hell when I try to eat or drink somethin. I'm so tired of feelin this way and I just wanna feel better already.""",Mouth/throat sores,blistering
51," ""My mouth is a battlefield, a war zone of sores and pain, a place where I dare not touch, a place where I dare not eat, a place where I dare not speak, a place where I dare not smile, a place where I dare not laugh, a place where I dare not kiss, a place where I dare not love, a place where I dare not live.""",Mouth/throat sores,mouth sores
52," ""I got these goddamn sores in my mouth and throat and it's driving me fucking crazy. I can't even eat or talk right. I'm so sick of these motherfucking sores.""",Mouth/throat sores,mouth/throat sores
53," ""I have mouth and throat sores that are painful and make it hard to eat and drink.""",Mouth/throat sores,mouth/throat sores
54," ""I got these blisters in my mouth and throat and it's scaring the shit out of me, I can't even swallow properly.""",Mouth/throat sores,mouth/throat sores
55," ""I have been experiencing these mouth and throat sores for the past week now, and they are very painful. I have been having difficulty eating and talking due to the pain.""",Mouth/throat sores,mouth/throat sores
56," ""I have been experiencing some sores in my mouth and throat for the past few days. They are quite painful and make it difficult for me to eat and talk.""",Mouth/throat sores,mouth/throat sores
57," ""I got these blisters in my mouth and throat, and they are so painful to eat and talk.""",Mouth/throat sores,mouth/throat sores
58," ""I've been having these weird sores in my mouth and throat for a while now. They're really painful and they keep coming back. I've tried everything to get rid of them but nothing seems to work. I'm really worried about them and I don't know what to do.""",Mouth/throat sores,mouth/throat sores
59," ""I've got these bloody sores in me mouth and throat, it's like me tongue is on fire and me throat is all sore and inflamed, I can't even swallow properly, it's like trying to swallow a bloody brick, I've had 'em before but this time they're worse than usual, I've been so stressed out lately with work and money and all that, I'm sure it's all down to me stress levels, I mean what's the point in living if you can't even enjoy a good meal without having to suffer like this, I'm so bloody fed up with it all, I just want to be able to eat and drink without having to worry about these bloody sores ruining me day, I mean what's the point in having a tongue if you can't even taste your food properly, it's like being half alive or something, I'm so bloody angry about it all, I just want to scream and shout and smash something, I mean what's the point in having a tongue if you can't even taste your food properly, it's like being half alive or something, I'm so bloody angry about it all, I just want to scream and shout and smash something, I mean what's the point in having a tongue if you can't even taste your food properly, it's like being half alive or something, I'm so bloody angry about it all, I just want to scream and shout and smash something, I mean what's the",Mouth/throat sores,mouth/throat sores
60," ""I've had these mouth/throat sores for a few days now and they're really annoying.""",Mouth/throat sores,mouth/throat sores
61," ""I have been having these mouth/throat sores for a while now, and they are really painful. They are these little red bumps that are raised and have a white coating on top. They are really itchy and sore, and when I eat or drink something, it hurts really bad. I have been trying to eat soft foods and avoid spicy or acidic foods, but it's still really painful. I also have been having some difficulty swallowing, and it feels like there is something stuck in my throat. I have been trying to swallow slowly and take small bites, but it's still really uncomfortable. I have been trying to avoid talking as much as I can, but when I do talk, it hurts really bad. I have been trying to avoid brushing my teeth and using mouthwash, but it's still really painful. I have been trying to avoid flossing, but it's still really painful. I have been trying to avoid eating or drinking anything hot or cold, but it's still really painful. I have been trying to avoid spicy or acidic foods, but it's still really painful. I have been trying to avoid smoking or drinking alcohol, but it's still really painful. I have been trying to avoid stress, but it's still really painful. I have been trying to avoid fatigue, but it's still really painful. I have been trying to avoid sleep deprivation, but it's still really painful. I have been trying to avoid poor nutrition, but it's still",Mouth/throat sores,mouth/throat sores
62," ""I have these sores in my mouth and throat that are very painful and keep me from eating and talking.""",Mouth/throat sores,mouth/throat sores
63," ""I have been experiencing these mouth/throat sores for the past week now and they are getting worse and worse. They are very painful and I can't even eat properly because of them. I have tried to treat them with some medication but it doesn't seem to be working. I am very frustrated and angry because I can't do anything about it.""",Mouth/throat sores,mouth/throat sores
64," ""I've had these mouth sores for a few days now and they're really annoying.""",Mouth/throat sores,mouth/throat sores
65," ""I've had these mouth/throat sores for a week now and they just won't go away. They're really painful and I can't even eat properly because of them.""",Mouth/throat sores,mouth/throat sores
66," ""I got these blisters in my mouth and throat and it's scaring the shit out of me, I can't even swallow properly, I'm so scared I'm gonna choke on my own vomit.""",Mouth/throat sores,mouth/throat sores
67," ""I have had mouth/throat sores for the past week.""",Mouth/throat sores,mouth/throat sores
68," ""I got these bloody sores in my mouth and throat and it's driving me bloody crazy. They're so painful I can't even eat or drink properly. I'm so bloody tired and weak all the time. I'm so bloody angry and frustrated all the time. I just want to get rid of these bloody sores already.""",Mouth/throat sores,"mouth/throat sores, pain"
69," ""Oh, my tongue is on fire, it feels like I have swallowed a thousand daggers, and my mouth is a battlefield, with sores everywhere, it's like I have been attacked by a swarm of bees.""",Mouth/throat sores,mouth/throat sores
70," ""My mouth is a bloody battlefield, with sores that are quite the inferno, and my throat is a parched desert that's dry as the Sahara!""",Mouth/throat sores,mouth sores
71," ""I have these sores in my mouth and throat that are really painful and keep coming back.""",Mouth/throat sores,mouth/throat sores
72," ""I got these bloody sores in me gob and they are proper painful, ya hear me?""",Mouth/throat sores,mouth/throat sores
73," ""I got these blisters in my mouth and throat, and it's been a week now.""",Mouth/throat sores,mouth/throat sores
74," ""I have been having quite a bit of trouble with mouth/throat sores, which makes it quite difficult for me to eat.""",Mouth/throat sores,mouth/throat sores
75," ""My mouth is a battlefield, with sores that are as red as rubies, and as sore as a thousand suns.""",Mouth/throat sores,mouth sores
76," ""I have these sores in my mouth and throat that are very painful and keep getting bigger and deeper. They are all over my tongue, the roof of my mouth, and the back of my throat. I have been trying to eat and drink, but it is very difficult and painful. I have been trying to talk, but it is very painful and I keep getting hoarse. I have been trying to sleep, but it is very uncomfortable and I keep waking up because of the pain. I am very worried that these sores are going to get worse and I will not be able to eat, drink, talk, or sleep properly.""",Mouth/throat sores,mouth/throat sores
77," ""My mouth is a battlefield, a war zone of sores and pain. Each one a reminder of the hell I'm living in.""",Mouth/throat sores,mouth/throat sores
78," ""I've got these blisters in me mouth and throat, and it's been going on for a few days now. It's really annoying because I can't eat or drink properly, and I've been having trouble talking to people too.""",Mouth/throat sores,mouth/throat sores
79," ""I cant even eat a meal without getting a sore in my mouth or throat. I am so sick of these stupid sores!""",Mouth/throat sores,mouth/throat sores
80," ""I've had these mouth/throat sores for a few days now and they're really annoying. They're quite painful and I can feel them when I talk or eat.""",Mouth/throat sores,mouth/throat sores
81," ""I've got these blisters in me mouth and throat, it's like I've swallowed a bloody fire.""",Mouth/throat sores,mouth/throat sores
82," ""I have mouth/throat sores, and they are very painful. They are also very itchy and I get these blisters inside my mouth and on my tongue. I have had them before, but this time they are worse and I have them all over my mouth and throat. I have been eating soft foods and trying to avoid spicy or acidic foods, but it is hard. I also have a fever and chills.""",Mouth/throat sores,"mouth/throat sores, fever"
83," ""I got these blisters in my mouth and throat and it's been 3 days now, I can't even swallow properly, I'm so thirsty but I can't drink water, I'm so sick of this shit.""",Mouth/throat sores,mouth/throat sores
84," ""I have these sores in my mouth and throat, they are really painful and make it hard for me to eat and drink, I have had them for a while now and they keep coming back, I don't know what to do.""",Mouth/throat sores,mouth/throat sores
85," ""I have mouth and throat sores that are very painful and make it hard to eat and drink.""",Mouth/throat sores,mouth/throat sores
86," ""I have these sores in my mouth and throat that are very painful and keep coming back.""",Mouth/throat sores,mouth/throat sores
87," ""I have Mouth/throat sores.""",Mouth/throat sores,Mouth/throat sores
