,Dialogue,True_Symptom,Extracted_Symptom
1013," ""I have been having this stomach pain for a while now, but it's gotten worse over the past few days. It's like a burning sensation that starts in the middle of my stomach and radiates outwards. It's so bad that I can't even sleep at night because I'm always in so much pain.""",Abdominal pain,abdominal pain
1014," ""Oh, my stomach is aching so much, it feels like a thousand knives are stabbing me, and I'm vomiting blood, and my abdomen is swollen and tender to the touch, and I have constipation, and I have a fever, and I have chills, and I have a headache, and I have a cough, and I have shortness of breath, and I have chest pain, and I have a runny nose, and I have a sore throat, and I have a rash, and I have itching, and I have joint pain, and I have muscle pain, and I have fatigue, and I have weakness, and I have dizziness, and I have insomnia, and I have anxiety, and I have depression, and I have memory loss, and I have concentration problems, and I have confusion, and I have personality changes, and I have loss of appetite, and I have weight loss, and I have weight gain, and I have abdominal distention, and I have abdominal mass, and I have abdominal tenderness, and I have abdominal guarding, and I have abdominal rebound tenderness, and I have abdominal organomegaly, and I have abdominal bruit, and I have abdominal friction rub, and I have abdominal striae, and I have abdominal dimpling, and I have abdominal erythema, and I have abdominal edema, and I have abdominal cellulitis, and I have abdominal abscess, and I have abdominal hernia",Abdominal pain,"abdominal pain, nausea, vomiting, fever, chills"
1015," ""I been having this pain in my tummy for a while now, it started a little bit after I ate some spicy food but it been getting worse and worse and now it hurts a lot, I been trying to sleep but I cant because it hurts so much, I been trying to eat but I cant because it hurts so much, I been trying to go to the bathroom but I cant because it hurts so much, I been trying to walk but I cant because it hurts so much, I been trying to sit down but I cant because it hurts so much, I been trying to stand up but I cant because it hurts so much, I been trying to lie down but I cant because it hurts so much, I been trying to talk but I cant because it hurts so much, I been trying to breathe but I cant because it hurts so much, I been trying to think but I cant because it hurts so much, I been trying to feel but I cant because it hurts so much, I been trying to dream but I cant because it hurts so much, I been trying to live but I cant because it hurts so much, I been trying to die but I cant because it hurts so much, I been trying to be born but I cant because it hurts so much, I been trying to grow up but I cant because it hurts so much, I been trying to be a man but I cant because it hurts so much, I been trying to be a woman but I cant because it",Abdominal pain,abdominal pain
1016," ""I been having this pain in my tummy for a while now, but it's not all the time, maybe once or twice a month, and it's not that bad, just a little bit of discomfort.""",Abdominal pain,abdominal pain
1017," ""I have severe abdominal pain, Nausea, Vomiting, Bloating, Loss of Appetite, Constipation, Diarrhea, Abdominal Swelling, Abdominal Mass, Abnormal Liver Enzymes, Abnormal Pancreatic Enzymes.""",Abdominal pain,"abdominal pain, nausea, vomiting, bloating, loss of appetite"
1018," ""I have abdominal pain, Nausea, Vomiting, Loss of Appetite, Bloating, Constipation, Diarrhea, Abdominal Swelling, Abdominal Mass, Abdominal Tenderness, Abdominal Rigidity.""",Abdominal pain,"abdominal pain, nausea, vomiting, bloating"
1019," ""I have abdominal pain. It is a dull, aching pain that is constant and does not move around. It is located in the middle of my abdomen, just below my belly button. It is not sharp or stabbing, and it is not triggered by anything in particular. It is just there all the time. It is not affected by eating or drinking, and it does not get worse or better with anything I do. It is just there all the time.""",Abdominal pain,abdominal pain
1020," ""I got this bloomin' stomach ache last night, an' it's still there this mornin', an' it's gettin' worse, an' I don't know what to do, an' I'm scared, an' I'm in a lot of pain, an' I need some help, an' I need it now, an' I can't take this no more, an' I'm gonna die, an' I'm gonna die, an' I'm gonna die, an' I'm gonna die, an' I'm gonna die, an' I'm gonna die, an' I'm gonna die, an' I'm gonna die, an' I'm gonna die, an' I'm gonna die, an' I'm gonna die, an' I'm gonna die, an' I'm gonna die, an' I'm gonna die, an' I'm gonna die, an' I'm gonna die, an' I'm gonna die, an' I'm gonna die, an' I'm gonna die, an' I'm gonna die, an' I'm gonna die, an' I'm gonna die, an' I'm gonna die, an' I'm gonna die, an' I'm gonna die, an' I'm gonna die, an' I'm gonna die, an' I'm gonna die, an' I'm gonna die, an' I'm gonna die, an' I'm gonna die, an",Abdominal pain,stomach ache
1021," ""My abdomen is aching like a festering wound, a constant reminder of the hell I'm enduring.""",Abdominal pain,abdominal pain
1022," ""I've been having this stomach pain for a few days now.""",Abdominal pain,abdominal pain
1023," ""My belly feels like a burning fire that rages on and on, and it's making me feel so sick and weak.""",Abdominal pain,abdominal pain
1024," ""I have been having abdominal pain for a few days now and it's getting worse.""",Abdominal pain,abdominal pain
1025," ""I have been experiencing severe abdominal pains since yesterday. It is very intense and I am worried that it might be something serious.""",Abdominal pain,abdominal pain
1026," ""I have been experiencing abdominal pain for the last three days now, and it is getting worse and worse. The pain is located in the lower right side of my abdomen, and it is moderate in intensity. It is a dull and aching pain, and it is constant. It does not move around or change in intensity. I have tried to rest and eat less spicy food, but it has not helped much. I also tried to take some painkillers, but they did not work either. I am worried that there might be something seriously wrong with me.""",Abdominal pain,abdominal pain
1027," ""Oh, my gut is on fire, it's burning up inside, and I feel like I'm going to explode, it's so painful, and I can't take it anymore, I'm so sick of this pain, it's driving me crazy, and I just want it to stop, please make it stop!""",Abdominal pain,abdominal pain
1028," ""I have this terrible stomach pain that I have never felt before.""",Abdominal pain,abdominal pain
1029," ""I've been having some abdominal pain for the past few days. It's a dull ache that seems to be centered around my belly button. It's not constant, but it does seem to get worse when I eat or move around a lot. I've been trying to eat lightly and avoid heavy lifting, but it doesn't seem to be helping much.""",Abdominal pain,abdominal pain
1030," ""I got this bloomin' stomach ache last night and it's still there this mornin', it's like a big ol' knife stabbin' me in the gut, I can't even get outta bed, I'm tellin' ya, it's a right bloody pain in the arse, I've had a few pints last night, but I'm not a big drinker, so I don't know what the hell is goin' on with me innards, I hope it ain't nothin' serious, I'm gettin' too old for this sorta thing, I'm tellin' ya, it's a right bloody pain in the arse.""",Abdominal pain,abdominal pain
1031," ""I'm surprised that you can't see how obvious it is that I have abdominal pain, you're not exactly the most perceptive person, are you?""",Abdominal pain,abdominal pain
1032," ""I got this cramp in my stomach, it's been going on for a few days now, and it's getting worse. It's like a knife stabbing me in the gut, and it's making me wanna puke. I can't sleep because of it, and I'm always worried it's gonna get worse.""",Abdominal pain,abdominal pain
1033," ""My abdomen has been aching for a little bit now, and it feels like a dull knife stabbing me in the gut.""",Abdominal pain,abdominal pain
1034," ""I have Abdominal pain, Nausea, Vomiting, Loss of Appetite, Bloating, Constipation, Diarrhea, Abdominal Distension, Abdominal Mass, Abdominal Tenderness, Abdominal Rigidity, Abdominal Guarding.""",Abdominal pain,"abdominal pain, nausea, vomiting, bloating"
1035," ""I'm dying, you stupid doctor, I have the most severe abdominal pain I've ever felt in my life.""",Abdominal pain,abdominal pain
1036," ""I have had abdominal pain for a little bit now.""",Abdominal pain,abdominal pain
1037," ""I have been having some abdominal pain lately, but I'm not sure what's causing it.""",Abdominal pain,abdominal pain
1038," ""Oh my god, I got this terrible stomach cramps, it's like someone is stabbing me with a knife, I'm so scared, I don't know what to do, I'm gonna die, I can feel it, I'm gonna puke, I'm gonna shit myself, I'm gonna pass out, I'm gonna die, I'm gonna die, I'm gonna die, I'm gonna die, I'm gonna die, I'm gonna die, I'm gonna die, I'm gonna die, I'm gonna die, I'm gonna die, I'm gonna die, I'm gonna die, I'm gonna die, I'm gonna die, I'm gonna die, I'm gonna die, I'm gonna die, I'm gonna die, I'm gonna die, I'm gonna die, I'm gonna die, I'm gonna die, I'm gonna die, I'm gonna die, I'm gonna die, I'm gonna die, I'm gonna die, I'm gonna die, I'm gonna die, I'm gonna die, I'm gonna die, I'm gonna die, I'm gonna die, I'm gonna die, I'm gonna die, I'm gonna die, I'm gonna die, I'm gonna die, I'm gonna die, I'm gonna die, I'm gonna die, I'm gonna die, I'm gonna die, I'm gonna die, I'm gonna die, I'm gonna die, I'm gonna die,",Abdominal pain,abdominal pain
1039," ""I've been having some abdominal pain for a few days now. It's a dull ache that comes and goes, and it's been getting worse over time. It's hard to pinpoint exactly where the pain is coming from, but it feels like it's in the middle of my stomach. I've been trying to eat a little bit, but it's hard to keep food down because of the pain. I've also been having some nausea and vomiting. I'm worried that there might be something seriously wrong with me.""",Abdominal pain,abdominal pain
1040," ""I got this cramp in my gut this morning, and it's been hurting like a motherfucker ever since. It's like someone took a goddamn baseball bat and smashed it into my stomach. I can't even take a shit without wincing in pain. I'm so sick of this shit, I just want it to go away already.""",Abdominal pain,abdominal pain
1041," ""I have been experiencing abdominal pain for the last three days.""",Abdominal pain,abdominal pain
1042," ""I have a little bit of abdominal pain.""",Abdominal pain,abdominal pain
1043," ""I have been experiencing abdominal pain for a while now, but it is not constant and only occurs occasionally.""",Abdominal pain,abdominal pain
1044," ""Oh no, I've been having this really bad stomach pain for a few days now. It's like a burning sensation in my tummy and it's making me feel really sick.""",Abdominal pain,abdominal pain
1045," ""I got this cramp in my gut, and it's been hurting a little bit.""",Abdominal pain,abdominal pain
1046," ""I have been having abdominal pain for a while now, it is usually on the lower right side of my abdomen and it is usually sharp and stabbing in nature, it is usually accompanied by nausea and vomiting, the pain is usually severe enough to wake me up at night and it is usually hard to find a position that relieves the pain.""",Abdominal pain,abdominal pain
1047," ""My belly is aching with a dull, heavy pain that seems to radiate from the pit of my stomach to the small of my back.""",Abdominal pain,
1048," ""I got this cramp in me gut, and it's been hurting a little bit for a few days now.""",Abdominal pain,abdominal pain
1049," ""I got this bloomin' stomach ache last night, and it's still there this mornin', and it's gettin' worse, and I don't know what to do.""",Abdominal pain,abdominal pain
1050," ""I got this stomach pain and it's really bad. It's like a knife stabbing me in the gut. It's been going on for a few days now and it's getting worse and worse. I tried to eat some food but it just makes it worse. I tried to drink some water but it just makes it worse. I tried to sleep but it just makes it worse. I tried to go to the bathroom but it just makes it worse. I tried to take a shower but it just makes it worse. I tried to go outside but it just makes it worse. I tried to talk to someone but it just makes it worse. I tried to think but it just makes it worse. I tried to breathe but it just makes it worse. I tried to live but it just makes it worse. I tried to die but it just makes it worse. I tried to kill myself but it just makes it worse. I tried to kill someone else but it just makes it worse. I tried to kill a whole bunch of people but it just makes it worse. I tried to kill the whole world but it just makes it worse. I tried to kill the whole universe but it just makes it worse. I tried to kill the whole multiverse but it just makes it worse. I tried to kill the whole omniverse but it just makes it worse. I tried to kill the whole metaverse but it just makes it worse. I tried to kill the whole xenoverse but it just",Abdominal pain,abdominal pain
1051," ""Oh, my gut is on fire, it's burning up inside, and I feel like I'm going to explode, it's so painful, and I can't take it anymore, I'm so sick of this pain, it's driving me crazy, and I just want it to stop, please make it stop!""",Abdominal pain,abdominal pain
1052," ""Oh my, I have been feeling so sick lately, I have this gnawing pain in my tummy that is making me feel so queasy, it is like a dull knife stabbing me in the gut, it is so uncomfortable, I have been trying to eat some crackers to calm my stomach down, but it is not working, I hope this pain goes away soon, I am so worried about it.""",Abdominal pain,"abdominal pain, nausea"
1053," ""I have been having this stomach pain for a few days now and it's getting worse and worse. It's like a burning sensation that starts in the middle of my stomach and radiates outwards. It's so bad that I can't even sleep at night because it keeps me up. I'm so scared that something is seriously wrong with me.""",Abdominal pain,abdominal pain
1054," ""Ah, bloody hell, I've got a right old bellyache, mate. It's been going on for a few days now, and it's getting worse by the minute. I've been trying to eat some bloody toast and tea, but even that's giving me the shits, if you know what I mean. I'm not sure what the bloody cause is, but I reckon it's probably something I ate. I've been eating a lot of spicy food lately, so maybe that's the problem. Or maybe it's something I drank. I've been having a few pints down at the pub with the lads, so maybe that's it. I don't know, man. I just know it bloody hurts, and I need it to stop.""",Abdominal pain,abdominal pain
1055," ""A dull ache in my abdomen, which is worse when I move around, and seems to radiate to my back and hips, making it hard for me to sleep, and causing me to wake up frequently during the night.""",Abdominal pain,abdominal pain
1056," ""My abdomen is on fire, and I feel like I'm going to explode.""",Abdominal pain,abdominal pain
1057," ""I got this bloomin' stomach ache last night, it was proper bad, I was up all night with it, I couldn't sleep for the pain, it was like a knife going through me, I was in a right state, I was sweating and everything, I was up and down to the loo all night, I was proper ill, I was in a lot of pain, I was in agony, I was in a right state, I was proper ill, I was in a lot of pain, I was in agony, I was in a right state, I was proper ill, I was in a lot of pain, I was in agony, I was in a right state, I was proper ill, I was in a lot of pain, I was in agony, I was in a right state, I was proper ill, I was in a lot of pain, I was in agony, I was in a right state, I was proper ill, I was in a lot of pain, I was in agony, I was in a right state, I was proper ill, I was in a lot of pain, I was in agony, I was in a right state, I was proper ill, I was in a lot of pain, I was in agony, I was in a right state, I was proper ill, I was in a lot of pain, I was in agony, I was in a right state, I was proper ill, I was in",Abdominal pain,stomach ache
1058," ""i cant stop crying because of my stomach hurting so bad""",Abdominal pain,abdominal pain
1059," ""I'm telling you, I've been feeling like I've been kicked in the gut all day. It's like a knife is stuck in my side and twisting it around. I can't even sleep at night because of the pain. I'm so sick of this already.""",Abdominal pain,general pain
1060," ""I got this bloomin' stomach ache and it's killin' me, ya hear? It's been goin' on fer days now and I can't take it no more, so get me some bloomin' painkillers or somethin'!""",Abdominal pain,abdominal pain
1061," ""My belly is aching with a dull, gnawing pain that is almost constant, and it feels as if my insides are churning like a cauldron of boiling acid.""",Abdominal pain,abdominal pain
1062," ""I got this bloomin' stomach ache last night, it was so bad I couldn't sleep, I was tossin' and turnin' all night long, and this mornin' it's still there, it's like a knife stabbin' me in the gut.""",Abdominal pain,abdominal pain
1063," ""I have had abdominal pain for a while now.""",Abdominal pain,abdominal pain
1064," ""Oh man, I got this really bad stomach ache, it's like a knife stabbing me in the gut, it's so painful, I can't even sleep at night because of it.""",Abdominal pain,abdominal pain
1065," ""My belly is aching with a dull ache that is hard to describe, as if a thousand tiny knives were stabbing me at once.""",Abdominal pain,abdominal pain
1066," ""Your medical skills are pathetic, I have been suffering from abdominal pain for quite some time now.""",Abdominal pain,abdominal pain
1067," ""My abdomen is a cauldron of fire, a bubbling pot of rage and resentment, a festering sore that refuses to heal.""",Abdominal pain,abdominal pain
1068," ""I been having this really bad stomach pain for a few days now, it's like a burning sensation in my belly and it's really hard to eat or sleep because of it.""",Abdominal pain,abdominal pain
1069," ""I've been having this stomach pain for a few days now, and it's getting worse and worse. It's like a burning sensation that starts in the middle of my stomach and radiates outwards. It's so bad that I can't even sleep at night because I'm so uncomfortable. I've tried eating less spicy food, but it doesn't seem to help. I'm really scared that something is seriously wrong with me.""",Abdominal pain,abdominal pain
1070," ""I've been having this really bad stomach pain for a while now.""",Abdominal pain,abdominal pain
1071," ""I got this bloomin' stomach ache and it's killin' me, ya hear? It's been goin' on fer days now and I can't take it no more!""",Abdominal pain,abdominal pain
1072," ""I've been having this stomach pain for a few days now, and it's getting worse and worse. It's like a burning sensation that starts in the middle of my stomach and radiates outwards. It's so bad that I can't even sleep at night because I'm so uncomfortable. I've tried eating less spicy food, but it doesn't seem to help. I'm really scared that something is seriously wrong with me.""",Abdominal pain,abdominal pain
1073," ""I have this constant stomach ache.""",Abdominal pain,abdominal pain
1074," ""My stomach hurts like hell, I feel sick all the time, I vomit a lot, I have diarrhea, I have a fever, I have chills, I have abdominal cramps, I have a loss of appetite, I have nausea.""",Abdominal pain,"abdominal pain, nausea, vomiting, diarrhea, fever"
1075," ""I have severe abdominal pain, Nausea, Vomiting, Loss of Appetite, Bloating, Constipation, Abdominal Distension, Abdominal Mass, Abdominal Tenderness, Abdominal Rigidity.""",Abdominal pain,"abdominal pain, nausea, vomiting, bloating"
1076," ""Stomach hurts like a motherfucker, man. I got cramps and diarrhea and nausea and vomiting. I feel like I'm gonna puke my guts out, bro.""",Abdominal pain,"abdominal pain, nausea, vomiting"
1077," ""Oh my god, I have been having this stomach pain for a week now and it's getting worse and worse. It's like a knife stabbing me in the stomach all the time. I can't sleep because of it and I'm always worried that it's going to get worse and I might end up in the hospital.""",Abdominal pain,abdominal pain
1078," ""I got this bloomin' stomach ache and it's killin' me, ya hear? It's been goin' on fer days now and it's gettin' worse and worse. I can't even sleep fer the bloomin' pain. It's like somethin' is eatin' away at me innards or somethin'. I'm tellin' ya, it's killin' me, it is.""",Abdominal pain,abdominal pain
1079," ""I have severe abdominal pain, Nausea, Vomiting, Bloating, Loss of Appetite, Constipation, Abdominal Distension, Abdominal Mass, Abdominal Tenderness, Abdominal Rigidity.""",Abdominal pain,"abdominal pain, nausea, vomiting, bloating, loss of appetite"
1080," ""I have been having severe stomach cramps for the past few days.""",Abdominal pain,abdominal pain
1081," ""I have been experiencing abdominal pain for the past few days. It is somewhat frequent and severe enough to disrupt my daily activities.""",Abdominal pain,abdominal pain
1082," ""I got this bloomin' stomach ache last night, an' it's still there this mornin', an' it's gettin' worse, an' I don't know what to do, an' I'm scared, an' I'm in a lot of pain, an' I need some help, an' I need it now, an' I can't take this no more, an' I'm gonna die, an' I'm gonna die, an' I'm gonna die, an' I'm gonna die, an' I'm gonna die, an' I'm gonna die, an' I'm gonna die, an' I'm gonna die, an' I'm gonna die, an' I'm gonna die, an' I'm gonna die, an' I'm gonna die, an' I'm gonna die, an' I'm gonna die, an' I'm gonna die, an' I'm gonna die, an' I'm gonna die, an' I'm gonna die, an' I'm gonna die, an' I'm gonna die, an' I'm gonna die, an' I'm gonna die, an' I'm gonna die, an' I'm gonna die, an' I'm gonna die, an' I'm gonna die, an' I'm gonna die, an' I'm gonna die, an' I'm gonna die, an' I'm gonna die, an' I'm gonna die, an",Abdominal pain,stomach ache
1083," ""My belly is on fire, it's burning like a furnace, it's aching like a knife, it's throbbing like a drum, it's churning like a blender, it's chafing like sandpaper, it's churning like a washing machine, it's chafing like a cheese grater, it's churning like a lawnmower, it's chafing like a chainsaw, it's churning like a blender, it's chafing like sandpaper, it's churning like a washing machine, it's chafing like a cheese grater, it's churning like a lawnmower, it's chafing like a chainsaw, it's churning like a blender, it's chafing like sandpaper, it's churning like a washing machine, it's chafing like a cheese grater, it's churning like a lawnmower, it's chafing like a chainsaw, it's churning like a blender, it's chafing like sandpaper, it's churning like a washing machine, it's chafing like a cheese grater, it's churning like a lawnmower, it's chafing like a chainsaw, it's churning like a blender, it's chafing like sandpaper, it's churning like a washing machine, it's chafing like a cheese grater, it's churning like",Abdominal pain,abdominal pain
1084," ""Oh man, I've been feeling so sick these past few days. I've had this really bad stomach pain that's been bothering me a lot. It's like a sharp pain that comes and goes, and it's been happening a lot more often lately. I've tried to ignore it, but it's getting harder and harder to do so. I'm starting to get worried that something might be wrong with me.""",Abdominal pain,stomach pain
1085," ""I have been experiencing severe abdominal pain for the past three days. The pain is located in the lower right quadrant of my abdomen and is constant and sharp in nature. It is worse when I move around and better when I lie down. I have also been experiencing nausea and vomiting. The vomiting is not forceful and I do not feel any abdominal cramping prior to vomiting. I have not had any diarrhea. I have a history of abdominal pain but it was not as severe as this time and it was not accompanied by nausea and vomiting. I do not have any other medical conditions and I do not take any medications.""",Abdominal pain,abdominal pain
1086," ""My belly is aching with a dull ache that is hard to describe.""",Abdominal pain,abdominal pain
1087," ""I got this bloomin' stomach ache last night, it was proper bad, I was up all night with it, I couldn't sleep for the pain, it was like a knife going through me, I was proper worried, I thought I was gonna die, I was sweating all over the place, I was in a right state, I was proper upset, I was crying me eyes out, I was in a right old state, I was proper upset, I was crying me eyes out, I was in a right old state.""",Abdominal pain,abdominal pain
1088," ""My abdomen is a furnace, burning with a fire that cannot be quenched. It is as if a thousand knives are stabbing me, each one piercing deeper than the last. I cannot stand upright, for the pain is too great, and I can only lie here, curled up in a ball, praying for the agony to cease.""",Abdominal pain,abdominal pain
