Dialogue,True_Symptom,Extracted_Symptom
"""My shoes are constantly tired from walking through life, they leak when I'm under pressure, they're severely blistered and cracked from all the walking I do, they ache from being worn out and I have to keep re-tightening the laces just to stay focused.""","['Fatigue', 'Urinary incontinence', 'Hand-foot syndrome (a rash of the hands and feet that can cause cracking, peeling, redness or pain)', 'Muscle pain', 'Concentration']",
"""I am currently experiencing moderate breast swelling and tenderness.""",['Breast swelling and tenderness'],
"""I'm feelin' pretty crummy, got some nasty bed sores, my mouth is super dry, and my ears are killin' me with that loud ringing.""","['Bed/pressure sores', 'Dry Mouth', 'Ringing in ears']",
"""Vomiting, Spitting Up, Stomach Pain, Loss of Appetite, Bloating, Food Poisoning, Abdominal Pain, Regurgitation, Gagging, Dry Mouth.""",['Nausea'],
"""I experiance a varity of issues with my feet, incuding: Nail discoloration (none), Foot pain, Swollen feet, Cracked heels, Fungal infections, Blisters, Ingrown toenails, Foot odor.""",['Nail discoloration'],
"""I've been experiencing very severe difficulty swallowing, which makes eating and drinking quite challenging for me.""",['Difficulty Swallowing'],
"""I'm experiencing ringing in ears, mouth/throat sores which are quite a bit interfering with daily activities, and severe anxiety that's also quite a bit interfering with daily activities.""","['Ringing in ears', 'Mouth/throat sores', 'Anxious']",
"""I've been experiensing alot of memory interference with my daily activities, it's very severe, and i've also been gettin heartburn pretty frequently, but it's only mildly painful, i've noticed some visual floaters, but i guess thats just normal, my vision is kinda blurry too, it's really affecting me, but only a little, and i've been noticin some swelling and tenderness in my breasts, but i dont know if thats normal or not.""","['Memory', 'Heartburn', 'Visual floaters', 'Blurred vision', 'Breast swelling and tenderness']",
"""My stomach, once a maelstrom of ravenous desire, now lies dormant, a desolate landscape devoid of appetite's fiery spark, its whispers of hunger reduced to an unsettling silence, a haunting reminder that even the most basic of needs can be wrested from my grasp.""",['Decreased appetite'],
"""My symptoms ar: Breast swelling and tenderness (my breats r all swollen and tender to the touch, hurts whn i touch them), Achieve and maintain erection (cant get or keep an errection, its like my bodi dont wanna cooperate), Hiccups (i get the hiccups ocasionaly, its not that bad, but sometimes they last for a bit, moderate pain).""","['Breast swelling and tenderness', 'Achieve and maintain erection', 'Hiccups']",
"""Joint pain, a symtome of sorts, caracterized by: occationaly painful joints, rarely, aching in my knees, almost never, stiffness in my hips, seldom, swelling in my ankles, hardly ever, limited mobility in my elbows, occassionally, inflammation in my wrists, rarely, tenderness in my shoulders, almost never, and a slight sense of discomfort in my fingers.""",['Joint pain'],
"""I got nail ridging, which meens its like, my nailz ar ridged and stuff, i dont no if thats good or bad, its like: ridged nailz, nailz arnt growin rite, nailz arnt lookin rite, nailz ar hurtin when i touch dem, nailz arnt lookin healthy, nailz arnt strong.""",['Nail ridging'],
"""I'm feelin' pretty weird, got discoloration on my nails, there's a lot of discharge goin' on down there, I'm kinda tired but can still do stuff, and honestly, I don't wanna talk about my vision right now.""","['Nail discoloration', 'Vaginal discharge', 'Fatigue', 'Blurred vision']",
"""My sleep-deprived soul is a wreck, my restlesness is a heavy burden, it interfiers with my daily activites alot, its a very severe afflication.""",['Insomnia'],
"""My shoes are severely anxious, frequently disrupting my daily activities, but somehow managing to get a good night's sleep without any issues, despite being in a state of overall darkness.""","['Anxious', 'Insomnia', 'Skin darkening']",
"""I've ben experinencin some pretty weird sympthoms lately, like my concetration is gettin a little bit messed up with daily actvities, it's not too bad but its moderatly annoyin, and somethin thats really gettin my goat is this ringing in my ears, its like someone's puttin a siren in my head, its so sevre it's keepin me up at nite, but you know what's almost as bad? these hot flashes, they come occassionally, but its like my body's decidin to just go haywire and give me a nice warm hug out of nowhere, its pretty mild but its just so annoyin!""","['Concentration', 'Ringing in ears', 'Hot flashes']",
"""Hard Stools, Straining during Bowel Movements, Infrequent Bowel Movements, Abdominal Discomfort, Loss of Appetite, Feeling of Incomplete Defecation.""",['Constipation'],
"""Persistent Earsong, Unrelenting Tinnitus, Tortured Silence, Ache of the Auditory Canal, Fractured Quiet, Dissonant Resonance, Sonic Assault, Echoes of Agony.""",['Ringing in ears'],
"""Pruritus, Luminescent Hallucinations, Giddiness.""","['Itching', 'Flashing lights', 'Dizziness']",
"""I've been feelin kinda crappy with this urination thingy, it hurts when i go pee, and i've got some mild acne goin on, just a few tiny spots.""","['Painful urination', 'Acne']",
"""I am presently experiencing a distressing condition characterised by an unrelenting and very severe itching sensation, which is manifesting as an intense and persistent discomfort, particularly in the vaginal region, albeit accompanied by a mild and somewhat manageable vaginal dryness, which, although bothersome, is not currently causing undue distress.""","['Itching', 'Vaginal dryness']",
"""I've got these weird mouth sores that don't really bother me and this heart thingy that's, uh, totally fine, I guess.""","['Mouth/throat sores', 'Heart palpitations']",
"""Apparently, my mouth/throat sores are moderately annoying, which is just great, considering they're interfering with my daily activities a little bit.""",['Mouth/throat sores'],
"""Me shoes got a bit of a funky look goin' on, got some discolored nails, all yellowy and stuff.""",['Nail discoloration'],
"""Oh, cruel fate, I fear my mortal coil is beset by the trifling troubles of acne's faintest whisper, a gentle reminder of my skin's fragile state, a minor annoyance that troubles me not at all, while my joints, those stalwart steeds that bear my weary frame, protest with a faint, insistent murmur, a gentle ache that, though it troubles me a little, does not, in truth, impede my daily rounds, and, as for my sweat, that most vital of bodily functions, I dare not even speak its name, lest it prove, like a will-o'-the-wisp, a fleeting mirage, a chimera that vanishes at my very thought.""","['Acne', 'Decreased sweating', 'Joint pain']",
"""Me boyo's got a wee problem, but I'm not exactly sure how often it's happenin'!""",['Ejaculation'],
"""I am experiening Irregular periods/vaginal bleeding, caracterised by: Vaginal bleeding, Menstrual cramps, Mood Swings, Fatigue, Bloating, Abdominal Pain, Anxiety, Sleep Disturbances, Weight Gain, Changes in libido.""",['Irregular periods/vaginal bleeding'],
"""Blimey, I'm bloody well plagued by these flaming lights, they're always there, a constant, maddening presence, like a swarm of fireflies in me eyeballs, no, not just in me eyeballs, but everywhere, a blasted, infernal display that refuses to bloody well cease, so, yeah, it's a definite 'yes' to the presence of these confounded lights, if you catch me drift.""",['Flashing lights'],
"""I seem to be experiencing certain discomforts, specifically the appearance of ulcers or sores on various parts of my body, which I believe may be attributed to prolonged periods of inactivity.""",['Bed/pressure sores'],
"""My shoes, I'm afraid, are experiencing an unusual condition, characterised by an excessive accumulation of air, occasional numbness, and a persistent, fiery sensation.""","['Bloating', 'Numbness & tingling', 'Hot flashes']",
"""Methinks I got sum kinda sickness, me heid hurts sumtimes wen I try to do ennythin, like I cant even think rite, me sex drive is non existent, dont no whats goin on with me boddy...""","['Headache', 'Decreased libido']",
"""I dont realy no if its somethin but i havent been yellin or talkin alot so my voice is just kinda... normal, i guess.""",['Hoarseness'],confidence
"""My feet feel weighed down, as if the very souls of my shoes have been pierced by the thorns of Discouragement, which sprouts Occasionally, its Moderate tendrils ensnaring my daily activities, a little bit, like a malignant vine, draining my vitality, its bitter fruit the taste of frustration.""",['Discouraged'],
"""I'm really scared, doc, I've got these nasty bed sores all over, I'm vomiting a lot, but it's not too bad, and sometimes I get these weird visions, but the worst part is when I have these random... ah, you know, wet dreams, it's just really unsettling.""","['Bed/pressure sores', 'Vomiting', 'Flashing lights', 'Ejaculation']",
"""Missed menstrual period, wheezing with mild symptoms, severe headaches that sometimes interfere with daily activities.""","['Missed expected menstrual period', 'Wheezing', 'Headache']",
"""Me eyes be seein' them dadburn specks everywhere, like I'm goin' blind or somethin'!""",['Visual floaters'],
"""Behold, my wheezing shoe, a non-entity in suffering, while my discouraged shoe, the wretched companion, trudges along with great reluctance.""","['Wheezing', 'Discouraged']",
"""U got these red welts all over me body, they itsch and its hurtin, they come and go, they aint nothin but a plesur, they got no name, they got no cure, they just a pain in me butt.""",['Hives'],
"""My skin is completly fine, no darkening or somethin, no paleness, no discoloration, no uneven tone, no dark spots, no skin changes, no melanin produktion problum, no nothin!""",['Skin darkening'],
"""M' body's a wreck, hurts everywhere, hurts some more in me muscles, don't know how much longer I can take it.""","['General pain', 'Muscle pain']",
"""I'm experiening a slight dificulty with achieving and maintaning an erection, but I'm managing quite well, and I've also been noticing some dryness and cracking at the corners of my mouth, although I'm not quite sure of the severity of the latter.""","['Cracking at the corners of the mouth (cheilosis/cheilitis)', 'Achieve and maintain erection']",
"""My voice is really raspy, I have a very severe hoarsness, it hurts to talk alot, my vocal cords are inflamed, I have a sore throat, difficulty swallowing, voice strain, vocal cord spasms, and a raspy voice.""",['Hoarseness'],
