Dialogue,True_Symptom,Extracted_Symptom
"""I am experiencing distressing symptoms, including numbness and tingling sensations that somewhat interfere with my daily activities, although I am uncertain about the severity of this condition, coupled with the presence of mouth and throat sores that significantly hinder my daily functioning, despite the lack of actual discomfort from these sores, and, I am afraid to acknowledge, a rather unsettling issue with delayed orgasm, which, I confess, renders this particular symptom somewhat irrelevant to my overall well-being.""","['Numbness & tingling', 'Mouth/throat sores', 'Delayed orgasm']",
"""Malaise, Disorientation, Confusion, Headaches, Fatigue, Difficulty Concentrating, Inability to Focus, Irritability, Anxiety, Restlessness, Sleep Disturbances, Memory Loss, Forgetfulness, Decreased Productivity, Discomfort, Unsettled Feeling, Mild Nausea, Abdominal Discomfort, Mild Diarrhea, Loss of Interest in Activities, Difficulty Engaging in Daily Routine, Mild Depression, Mild Anxiety, Mild Panic Attacks, Mild Insomnia, Mild Hypersomnia.""","['Rash', 'Decreased appetite', 'Breast swelling and tenderness']",
"""I experience a moderate level of interference with my daily activities due to mild shortness of breath, which manifests as a subtle yet noticeable limitation in my ability to engage in physical exertion without feeling slightly winded.""",['Shortness of breath'],
"""My shoes got a bad case of bronchitis, they cant even walk a block without coughin like crazy, they got a lil breast lump goin on, but its no biggie, and dont even get me started on their memory, its totaly shot, they cant even remember where they put ther keys!""","['Coughing', 'Breast swelling and tenderness', 'Memory']",
"""I've got these sympthoms: Bruising - nothin's happenin' there, Muscle pain - its killing me, i cant even move arond, its like i got shot with a gun, i mean its severe and all, i cant do nothin, Shortness of breath - i dont feel it thats weird, i mean i can stil walk arond, but its like my lungs r on fire, and Dizziness - dont ask me about this one, its just too embarasin, lets just say i feel like i m gonna pass out all the time, its like my brain r spinnin, i dont no whats goin on.""","['Bruising', 'Muscle pain', 'Shortness of breath', 'Dizziness']",
"""Uh, my symptomes r: Cracking at the corners of my mouth (its like, super dry and stuff) - its mild, Breast swelling and tenderness - um, not really a big deal, I guess...""","['Cracking at the corners of the mouth (cheilosis/cheilitis)', 'Breast swelling and tenderness']","Breast swelling and tenderness, Cracking at the corners of the mouth"
"""My poor, fragile form, now beset by the woeful dualities of existence, as my abdomen, a tempest-tossed vessel, doth occasionally protest, its murmurs of discontent a gentle reminder of life's fragile dance, while, alas, my bladder, a traitorous vessel, doth almost constantly betray me, its incontinent sighs a constant reminder of my mortal frailty.""","['Abdominal pain', 'Urinary incontinence']",
"""Vaginal dryness = super dryness down ther, Painful urination = just a lil discomfort whn i pee, Increased sweating = occashunally i get all sweaty, Radiation skin reaction = nothing's happenin, just a normal skin, like i dont even have cancer or somethin.""","['Vaginal dryness', 'Painful urination', 'Increased sweating', 'Radiation skin reaction']",
"""My feet are killing me, I have constant, severe pain that makes it hard to do anything, and I'm worried I'm going to develop sores from sitting here all day.""","['General pain', 'Bed/pressure sores']",
"""My shoes are experiencing a distressing condition, characterised by a voice that has become increasingly hoarse, with a severe inability to swallow, resulting in an overall discomfort that somewhat hampers my daily activities.""","['Voice quality changes', 'Shortness of breath', 'Difficulty Swallowing']",
"""I'm stuck with Itching (None), Urinary frequency (Very much interference, Rarely occurring).","['Itching', 'Urinary frequency']",
"""My fatigue, a gentle thief, steals quite a bit of my daily vitality, its mild touch an insidious whisper in the morning's hush.""",['Fatigue'],
"""Unexpected and Unpredictable Episodes of Ejaculation, Sudden Loss of Control, Discomfort and Anxiety, Difficulty Concentrating, Feelings of Embarrassment and Shame, Changes in Mood, Fear of Public Places, Social Withdrawal, Difficulty Sleeping, and General Sense of Unease.""",['Ejaculation'],
"""I be gettin' these Hot flashes, like, rarely, but when they come, they be severe, I'm talkin' my whole body be breakin' out in sweat, my heart be racin', and I be feelin' like I'm gonna pass out, it's like my insides be on fire, and I be gettin' these hot, flushy feelings, like my skin be on fire, it's a right proper mess, I swear.""",['Hot flashes'],
"""Sunburns, Blistering, Peeling, Itching, Redness, Swelling, Burning Sensations, Numbness, Tingling, Blisters, Crusting, Dryness, Inflammation, Discomfort, Aggravation when exposed to Direct Sunlight, Increased Risk of Skin Cancer, Premature Aging of the Skin, Discoloration, Hyperpigmentation, Hypersensitivity to UV Rays, Irritation, Rash, Erythema, Dermatitis, Phototoxicity, Solar Urticaria, Photoallergic Reactions, Skin Inflammation, Pain, Swollen Lymph Nodes, Fever, Chills, Malaise, Nausea, Vomiting, Diarrhea, Abdominal Pain, Headaches, Dizziness, Fatigue, Weakness, Irritability, Anxiety, Depression, Confusion, Disorientation, Hallucinations, Memory Loss, Cognitive Impairment, Mood Swings, Personality Changes, Suicidal Thoughts, Suicidal Behaviors, Suicidal Tendencies.""",['Sensitivity to sunlight'],
"""Me shoes are bloody itching like mad, don't they know I'm suffering?""",['Itching'],
"""I'm havin a bloody melt down every 5 minutes or somethin, these hot flashez come outta no where and are so sever that i feel like i'm stuck in a furnace, they last for like a minit and then dissapear leavin me sweatin like a pig and feelin like a complete idiot, it's a real pain in the arse, i swear, i'm gettin these hot flashez RARELY, but when they hit me, they're like a nuclear blast, VERY SEVER, i'm talkin like my face is on fire, my body's covered in sweat and i'm feelin like i'm losin my mind, it's a bloody nightmare, i need some help here, doc!""",['Hot flashes'],
"""I'm experiencing joint pain that affects my daily activities quite a bit, with almost constant episodes, but the pain itself isn't severe; I've also been noticing some shortness of breath that impacts my daily activities to a lesser extent, and I'm having general pain that's somewhat frequent, though I'm not sure how to rate its severity.""","['Joint pain', 'Shortness of breath', 'Decreased sweating', 'Vaginal discharge', 'Voice quality changes', 'General pain']",
"""I am astonished that you require such a pedestrian description of my symptoms, but very well, I suppose I shall deign to inform you that my shoes appear to be afflicted with an alarming propensity for excessive perspiration, manifesting as a perpetual sheen, much like the unwashed masses who populate this establishment, and a faint discoloration, though I dare say it is nothing compared to the tedium of my existence, a far cry from the rich, deep tones that would be expected of a well-bred gentleman such as myself.""","['Increased sweating', 'Skin darkening']",
"""I'm experiencing some weird stuff, my body's acting up, I'm sensitive to sunlight, don't know why, I'm not having diarrhea, but I'm having a lot of nosebleeds, it's kinda moderate, I guess.""","['Sensitivity to sunlight', 'Diarrhea', 'Nosebleed']",
"""I'm experiancing extreem skin dryness, my skin is as parched as the sahara desart, and my taste buds are acting strangly, I'm affraid I may be experiancing some sort of flavour alteration, but I'm not at liberty to discus the severity of this sympdom, suffice it to say it's quite distressing.""","['Skin dryness', 'Taste Changes']",
"""I am experiencing the following difficulties with swallowing: Painful Swallowing, Frequent Regurgitation, Feeling of Food Lodging in the Throat, Swallowing Difficulty with Liquids, Swallowing Difficulty with Solid Foods, Swallowing Difficulty with Both Liquids and Solid Foods, Feeling of Swallowing Obstruction, Feeling of Swallowing Pain, Frequent Choking, Feeling of Swallowing Struggling, Feeling of Swallowing Discomfort, Feeling of Swallowing Anxiety, Feeling of Swallowing Fear, Feeling of Swallowing Panic, Swallowing Difficulty with Certain Textures, Swallowing Difficulty with Certain Flavors, Swallowing Difficulty with Certain Temperatures.""",['Difficulty Swallowing'],
"""I'm experiancing some reallly bad urinary frequncy issues, it's geting to the point where I'm havng to run to the bathroom like 5 times a day, it's a littel annoying becaus it's interfering with my daily activites, like I'll be in the middel of somthing and I'll just have to stop and go, it's happenig pretty rareley, but it's stil causin me alot of stres and I'm geting a littel worried it might be somthing serius.""",['Urinary frequency'],
"""O, cursed fate that hath beset me with a languid languor, where sweat doth scarce trickle from my pores, like a sluggish brook in arid summer's grasp, and joints, once supple and free, now ache with a dull, muffled pain, that doth intrude not at all, nay, not even rarely, upon my daily rounds, for I, a warrior, am not brought low by such a paltry affliction.""","['Decreased sweating', 'Joint pain']",
"""I am currently experiencing rather distressing oral and pharyngeal lesions, which are causing considerable impediments to my daily routine, and concurrently, I am intermittently afflicted by intense, albeit infrequent, heat surges that are profoundly debilitating.""","['Mouth/throat sores', 'Hot flashes']",
"""I've been experiencing quite a bit of interference with my daily activities almost constantly, but to be honest, the thought of it is so overwhelming that I'm having trouble even thinking about how severe it's been, if you know what I mean.""",['Discouraged'],
"""Foul cough, a constant curse, that wracks my frame with furious force, leaving me crippled, crippled, by its incessant, maddening interference.""",['Coughing'],
"""Interference with daily activities, such as forgetting appointments, not recalling recent conversations, struggling to remember familiar places, difficulty learning new information, frequent mental blocks, forgetting to perform routine tasks, inability to recall names of people I know, and trouble remembering recent events.""",['Memory'],
"""I'm experiening skin darkning thats just great, not that its relevent but its just gettin darker and I dont no why, its just hapenning.""",['Skin darkening'],
"""Alas, I find myself beset by a trifling trio of woes: my urine, once a crystal clear elixir, now reeks of a ghastly amber hue, a stark reminder of my own mortality; my womb, that most private of sanctuaries, remains stubbornly vacant, its usual monthly visitor a no-show, and my nether regions, a veritable swamp, overflowing with a viscous, honey-like discharge, a testament to the chaos that brews within me.""","['Change in usual urine color', 'Missed expected menstrual period', 'Vaginal discharge']",
"""My poor shoes are feeling quite downtrod, with a rash on the toes that wont heal, aching joints that never cease, and a mind that wont sleep, though my heart is somewhat sad.""","['Sad', 'Hand-foot syndrome (a rash of the hands and feet that can cause cracking, peeling, redness or pain)', 'Joint pain', 'Unable to have orgasm', 'Insomnia']",
"""I am currently experiencing a multitude of distressing manifestations, which I shall endeavour to describe, and they are as follows: my countenance is beset by a plethora of mild, yet bothersome, comedones, which are small, round, and sometimes accompanied by a whitehead, these lesions are predominantly situated on my facial region, particularly on my forehead, nose, and chin, and they appear to be of a moderate intensity, not excessively inflamed or painful, but still causing me considerable concern and discomfort.""",['Acne'],
"""Methinks my vocal cords, a duo of tender threads, now sing in muted tones, a moderate murmur, beset by an uninvited guest, whose presence I can scarce define, yet knows no gentle bounds.""",['Hoarseness'],
"""Oh man, my shoes are like me right now, I've got wet spots everywhere from losin all contro ov my blady, I've got cracks in my soles like cheilosis on my lips, my arches hurt somtimes like a bad cramp, and I dont wanna think about the mess I make when I'm sick...""","['Urinary incontinence', 'Cracking at the corners of the mouth (cheilosis/cheilitis)', 'Abdominal pain', 'Vomiting']",
"""I am experiencing intermittent bouts of vomiting, the frequency of which is unpredictable, and I am reluctant to disclose the intensity of these episodes, as the mere contemplation of their severity fills me with a sense of trepidation.""",['Vomiting'],
"""My dear shoes, you would feel a gentle whisper of discomfort, a rare and mild ache that doesn't quite hinder my steps, a sensitivity to the warmth of the sun that I'd rather not dwell upon, and an occasional, itchy itch that I'd rather not scratch at.""","['Abdominal pain', 'Sensitivity to sunlight', 'Hives', 'Itching']",
"""I'm experiencing severe heartburn and occasional nosebleeds.""","['Heartburn', 'Nosebleed']",
"""My gut's blowin' out all over the place, can't sleep, and I'm as dry as the Sahara desert.""","['Fecal incontinence', 'Insomnia', 'Decreased sweating']",
"""I'm bloody well reeking like a dumpster on a hot summer day, my armpits are so damn stinky that it's like a toxic waste dump is brewing in there, I'm sweating like a sinner in church and my stench is so overpowering that it's making everyone within a five-foot radius gag, my very severe body odor is like a bad joke, it's a constant reminder that I'm a walking biohazard, I'm so self-conscious about it that I'm starting to feel like a freak, my sweat glands are working overtime and I'm producing more BO than a brewery, it's like my body is a stinky little furnace that's burning up all my dignity and leaving me feeling like a bloody embarrassment, my very severe body odor is literally making my life a living hell!""",['Body odor'],
"""I am experiancing a rather puzzling condition wherein my shoes seem to be afflicted with a urinary frequensy disorder, resultin in them requirin frequent trips to the shoe repair shop, where they are losin a considerable amount of their hair, and in a strange twist, my shoe laces have become swollen and tender to the touch, although I must admit the severity of this symptom is quite negligible.""","['Urinary frequency', 'Hair loss', 'Breast swelling and tenderness']",
"""I'm experiencing some issues with my body, like, I've been vomiting, but I'm not really sure how often, and it's not like it's super severe or anything, and then there's this dryness on my skin, which is kind of moderate, I guess.""","['Vomiting', 'Skin dryness']",
"""Alas, my poor shoes, beset by fitful chills, a rare but merciless affliction, that strikes with unrelenting ferocity, as if the very essence of winter had taken up residence within their leather confines.""",['Chills'],
"""Alas, my pitiful physician, behold my wretched form, where nail ridging doth mock me with its very absence, and bloating, that most insufferable of afflictions, doth beset me with its rare and mild intrusions, a gentle reminder of my own miserable existence.""","['Nail ridging', 'Bloating']",
"""I'm experiencing a lovely combination of symptoms, including a noticeable absence of stretch marks, because let's be real, who needs those, and a memory that's only slightly interfering with my daily activities, because I'm not completely incompetent, with no apparent severity, because I'm not actually losing my mind, but honestly, it's a miracle I can still recall my own name.""","['Stretch marks', 'Memory']",
"""U gotta check me out, I got hives all over my body, like I'm allergic to my own skin or somethin, and my feet and hands are numb and tingley, like I've been sleepin on em or somethin, its pretty bad, I cant even walk or do nothin, its like I'm a cripple, and dont even get me started on my ears, I got this ringin in my ears, but its not that bad, I mean, its not like its hurtin or anythin, its just a lil annoyin, but I guess thats better than havin a headache or somethin, and then theres the sex thing, u know, its like, I cant even get it up, its all sore and stuff, I mean, its like my junk is tryin to tell me somethin, but I dont know what, maybe its just tryin to say'stop wankin and get some help, u idiot'"".","['Hives', 'Numbness & tingling', 'Ringing in ears', 'Pain with sexual intercourse']",
"""I'm experiening somwhat of a fatigue issue, its mainlly interferring with my daily activites, especialy in the morning when I wake up, I feel like I dont have the energi to do alot of things, its not like I'm completly exausted or any thing, I just feel like I'm runing on low batterie, I can still do stuff but it takes alot more efford than normal, its kinda like my body is saying 'hey, slow down a bit'.""",['Fatigue'],
"""Joint pain is a minor nuisance that occasionally hinders my daily routine.""",['Joint pain'],
"""Me shoes got a bad case of the blues, they're feelin' the pain in their cranium, it's a rare but mighty headache that's interferin' with me daily steps, and their lungs are all congested, coughin' up a storm, quite a bit, but they're still standin', even if they're feelin' severely worn out.""","['Headache', 'Coughing']",
"""I am presently experiencing a rather distressing and uncharacteristic condition, wherein I find myself afflicted with a persistent and pungent body odor, which I am hesitant to quantify in terms of severity, and, regrettably, a rather pronounced and almost constant issue with ejaculation, which, I must confess, is occurring with a frequency that is both unexpected and somewhat concerning.""","['Body odor', 'Ejaculation']",
"""i've got this one symptom where my periods are all over the place, i get vaginal bleeding sometimes, it's a real pain, then theres this other thing where i gotta be careful not to pee myself, it's only a little annoying, but it's happenin' pretty rare, and dont even get me started on my sex life, it's just not there, it's like i'm completly fine, but i'm not, i'm just feelin' kinda...meh.""","['Irregular periods/vaginal bleeding', 'Urinary incontinence', 'Decreased libido']",
"""I'm experiencing a range of unsettling symptoms, including a decreased libido that I'm hesitant to discuss, a severe loss of appetite that's interfering with my daily routine to a great extent and is extremely severe, a peculiar but non-disruptive hoarseness, infrequent but unsettling hot flashes that I'm not comfortable discussing, and a dry mouth that's not causing any noticeable issues.""","['Decreased libido', 'Decreased appetite', 'Hoarseness', 'Hot flashes', 'Dry Mouth']",
"""I'm experiencing this general pain that's interfering with almost everything I do, making it extremely difficult for me to perform even the simplest tasks, and I'm too anxious to even think about how often it's happening or how bad it's getting.""",['General pain'],
"""Me shoes got a mild case of the itches, hands and feet are all red and cracky like a cheap pair of boots, and me toes are all numb and tingly like they're sleepin' in a ditch.""","['Hand-foot syndrome (a rash of the hands and feet that can cause cracking, peeling, redness or pain)', 'Numbness & tingling']",
"""Got a Rash that's drivin' me bloody mad, it's itchy, red, and I'm not tellin' you if it's gone or still here, but it's causin' me a right ol' headache.""",['Rash'],
"""Anxious feelings interfere with daily activities quite a bit, occur occasionally, and are very severe; Vaginal dryness is a sensitive topic and I'd rather not discuss it; Unable to have orgasm is a private matter and I'd prefer not to answer; Ringing in ears is a concern I'd rather not elaborate on; Urinary urgency interferes with daily activities a little bit and occurs almost constantly.""","['Anxious', 'Vaginal dryness', 'Unable to have orgasm', 'Ringing in ears', 'Urinary urgency']",
"""My dear fellow, I seem to be experiencing a rather peculiar condition, whereby my personal hygiene is not quite up to par, despite my best efforts, and, I'm afraid, my sleep patterns are quite disrupted, significantly impacting my daily routine.""","['Body odor', 'Insomnia']",
"""I've got Vaginal discharge, lots of it, and Heartburn, never happens, dont even get me started on that one.""","['Vaginal discharge', 'Heartburn']",
"""I'm gettin' these blasted chills occasionally, like a naggin' cold breeze on a hot summer day, but they're so mild they're practically nonexistent, a joke, a dadburn tease, just a faint shiver that's more irritatin' than hurtful.""",['Chills'],
"""Upon examination, I do not exhibit any noticeable signs of bruising, and my skin appears unblemished, without any discoloration, swelling, or other visual manifestations that would be indicative of bruising.""",['Bruising'],
"""My poor shoe, it's sole is beset with a melancholy that interferes with its daily strides, a constant ache that plagues it almost without cease, a severe affliction that renders its usual gait most irregular and unpredictable, like a woman's menstrual cycles, which, alas, seem to be in a state of utter disregard for the natural order.""","['Sad', 'Irregular periods/vaginal bleeding']",
"""I am presently afflicted with an unrelenting and distressing condition, wherein my digestive system has seen fit to betray me by producing an incessant and copious flow of liquid feces, which, I dare say, is a most inconvenient and unpleasant occurrence, happening with a frequency that is nothing short of alarming, thus rendering my daily existence a veritable ordeal, a trial by fire, if you will.""",['Diarrhea'],
"""I'm experiencing a frustrating condition where my orgasm is consistently delayed, making intimate moments feel like an eternity, and to add insult to injury, I'm constantly plagued by a maddening urinary urgency that interferes with almost every aspect of my daily life, severely disrupting my routine with its almost constant presence.""","['Delayed orgasm', 'Urinary urgency']",
"""My feet are experiencing nausea, as they occasionally feel queasy and moderately uncomfortable, my toes are watery-eyed, somewhat impairing my ability to walk, but not severely, and my heel is irregularly bleeding, yes, I'm having vaginal bleeding, because apparently, my feet have a uterus.""","['Nausea', 'Watery eyes', 'Irregular periods/vaginal bleeding']",Irregular periods/vaginal bleeding
"""I experiance irregular periods/vaginal bleeding, skin dryness, hoarsness, which manifest as No Irregular periods/vaginal bleeding, Mild skin dryness, Not applicable hoarsness.""","['Irregular periods/vaginal bleeding', 'Skin dryness', 'Hoarseness']",
"""During the past week, I have experiened occassional episodes of moderate increated sweating, particularely noticable during periods of stress or physical activites, which has resulted in a slight interfarence with my daily routine. In additon, I have noticed a little bit of interfarence with my daily activites due to urinary incontinence, although the frequency of this sympdom is somewhat dificult to quantify. Furthermore, I have been experiencing severe joint pain, which has become a frequent occurence, often resulting in a significant interfarence with my daily activites.""","['Increased sweating', 'Urinary incontinence', 'Joint pain']",
"""Me shoes, they got quite a bit of hair losin' goin' on, like I've been sheddin' like a mangy beast, and they're hurtin' all over, like I've been walkin' on hot coals, makin' it hard to do much of anythin' most times, but not always, if you know what I mean.""","['Hair loss', 'General pain']",
"""I am experiancing a Rash, which is currently not presant on my body, however I have had a hisotry of them in the pas.""",['Rash'],
"""I do beleev my shoes are experinshing a rather peculier condition, where the urine it produceth has undergone a most unpleasenth change in its usual colur, a metamorphosis of sorts, from a pristine clarity to a most unflattering shade of, well, I dare not say, and this, combined with the palpitations of its cardiac systim, which, I might add, occur with a frequency that can only be describhed as rare, a mere whisper of distress, a faint flutter, if you will, a severity that I, in my infinite wisdom, see fit to keep to myself, a mystery, much like the workings of the human heart, or, indeed, the workings of my own, most persnickety, and fastidious, mind.""","['Change in usual urine color', 'Heart palpitations']",
"""I am experiencing a most distressing condition of extreme aridity within my oral cavity, wherein my mouth is persistently and painfully desiccated, rendering it extremely uncomfortable and severely debilitating.""",['Dry Mouth'],
"""In times of quiet contemplation, I find myself untouched by the gentle stirrings of seminal release, a stillness that persists, a void that remains.""",['Ejaculation'],
"""Shortness of breath is affecting me severely, Diarrhea is occurring frequently, General pain is bothering me occasionally.""","['Shortness of breath', 'Diarrhea', 'General pain']",
"""Man, my feet are killin me, I got pain everywhere, cant even walk without feelin it, its like somethin is crushin my toes all day, and I feel so down on myself, like I dont even wanna get outta bed, its just so frustrating!!""","['General pain', 'Discouraged']",
"""My shoes are feeling Discouraged, they dont wanna get used cuz its A little bit of a pain to walk aroun with them and they are Never in the mood to get worn out but they are Very severe whiners.""",['Discouraged'],
